{"external_url":"https://fullhd-wallpapers-brinis.blogspot.com/","properties":{"Background":"green background","character":"yellow pink feet","Hat":"Mafia black hat","Necklace":"Golden necklace 2","Glasses":"Ice glasses"},"name":"Pixel Art Cute Pada #1188","description":"Pixel Art Cute Panda is a collection of 5,000 unique generated pixel art Panda, stored on the Polygone Blockchain.   #webarebears #cuteanimals #like #icebear #instapanda #instagood #pandaexpress #pandacub #fiat #fiatpanda #redpanda #ilovepandas #x #zoo #wildlife #grizzlybear #handmade #music #apink #artist #china #pandaholic #fashion #teddybear #grizzly #japan #babyanimals #o #pubg #eunji  #panda #pandas #pandabear #pandalove #pandalover #love #cute #pandalife #pandalovers #pandababy #pandaworld #pandabears #pandastyle #bear #cutepanda #art #giantpanda #animals #babypanda #pandapower #pandacute #pandapanda #pandasofinstagram #pandagram #instagram #photography #animal #nature #pandaeyes #bhfyp _green background_yellow pink feet_Mafia black hat_Golden necklace 2_Ice glasses","image":"https://raw.githubusercontent.com/GamingPromotions/picHost/main/PandaCute/PixelArtBigger512/6230.jpg","attributes":null}
