{"external_url":"https://fullhd-wallpapers-brinis.blogspot.com/","properties":{"Background":"green background","character":"pink","Hat":"big wizard hat left","Necklace":"Golden necklace","Glasses":"3D glasses"},"name":"Pixel Art Cute Pada #2040","description":"Pixel Art Cute Panda is a collection of 5,000 unique generated pixel art Panda, stored on the Polygone Blockchain.   #webarebears #cuteanimals #like #icebear #instapanda #instagood #pandaexpress #pandacub #fiat #fiatpanda #redpanda #ilovepandas #x #zoo #wildlife #grizzlybear #handmade #music #apink #artist #china #pandaholic #fashion #teddybear #grizzly #japan #babyanimals #o #pubg #eunji  #panda #pandas #pandabear #pandalove #pandalover #love #cute #pandalife #pandalovers #pandababy #pandaworld #pandabears #pandastyle #bear #cutepanda #art #giantpanda #animals #babypanda #pandapower #pandacute #pandapanda #pandasofinstagram #pandagram #instagram #photography #animal #nature #pandaeyes #bhfyp _green background_pink_big wizard hat left_Golden necklace_3D glasses","image":"https://raw.githubusercontent.com/GamingPromotions/picHost/main/PandaCute/PixelArtBigger512/2585.jpg","attributes":null}
