{"external_url":"https://fullhd-wallpapers-brinis.blogspot.com/","properties":{"Background":"green background","character":"red","Hat":"big wizard hat left","Necklace":"Golden necklace 2","Glasses":"none"},"name":"Pixel Art Cute Pada #2183","description":"Pixel Art Cute Panda is a collection of 5,000 unique generated pixel art Panda, stored on the Polygone Blockchain.   #webarebears #cuteanimals #like #icebear #instapanda #instagood #pandaexpress #pandacub #fiat #fiatpanda #redpanda #ilovepandas #x #zoo #wildlife #grizzlybear #handmade #music #apink #artist #china #pandaholic #fashion #teddybear #grizzly #japan #babyanimals #o #pubg #eunji  #panda #pandas #pandabear #pandalove #pandalover #love #cute #pandalife #pandalovers #pandababy #pandaworld #pandabears #pandastyle #bear #cutepanda #art #giantpanda #animals #babypanda #pandapower #pandacute #pandapanda #pandasofinstagram #pandagram #instagram #photography #animal #nature #pandaeyes #bhfyp _green background_red_big wizard hat left_Golden necklace 2_none","image":"https://raw.githubusercontent.com/GamingPromotions/picHost/main/PandaCute/PixelArtBigger512/4062.jpg","attributes":null}
