{"external_url":"https://fullhd-wallpapers-brinis.blogspot.com/","properties":{"Background":"gray background","character":"panda","Hat":"black cap hat","Necklace":"none","Glasses":"Black Sunglasses white reflection"},"name":"Pixel Art Cute Pada #2509","description":"Pixel Art Cute Panda is a collection of 5,000 unique generated pixel art Panda, stored on the Polygone Blockchain.   #webarebears #cuteanimals #like #icebear #instapanda #instagood #pandaexpress #pandacub #fiat #fiatpanda #redpanda #ilovepandas #x #zoo #wildlife #grizzlybear #handmade #music #apink #artist #china #pandaholic #fashion #teddybear #grizzly #japan #babyanimals #o #pubg #eunji  #panda #pandas #pandabear #pandalove #pandalover #love #cute #pandalife #pandalovers #pandababy #pandaworld #pandabears #pandastyle #bear #cutepanda #art #giantpanda #animals #babypanda #pandapower #pandacute #pandapanda #pandasofinstagram #pandagram #instagram #photography #animal #nature #pandaeyes #bhfyp _gray background_panda_black cap hat_none_Black Sunglasses white reflection","image":"https://raw.githubusercontent.com/GamingPromotions/picHost/main/PandaCute/PixelArtBigger512/620.jpg","attributes":null}
