{"external_url":"https://fullhd-wallpapers-brinis.blogspot.com/","properties":{"Background":"pink background","character":"panda","Hat":"Wizard hat","Necklace":"Golden necklace 2","Glasses":"Sunglasses orange"},"name":"Pixel Art Cute Pada #390","description":"Pixel Art Cute Panda is a collection of 5,000 unique generated pixel art Panda, stored on the Polygone Blockchain.   #webarebears #cuteanimals #like #icebear #instapanda #instagood #pandaexpress #pandacub #fiat #fiatpanda #redpanda #ilovepandas #x #zoo #wildlife #grizzlybear #handmade #music #apink #artist #china #pandaholic #fashion #teddybear #grizzly #japan #babyanimals #o #pubg #eunji  #panda #pandas #pandabear #pandalove #pandalover #love #cute #pandalife #pandalovers #pandababy #pandaworld #pandabears #pandastyle #bear #cutepanda #art #giantpanda #animals #babypanda #pandapower #pandacute #pandapanda #pandasofinstagram #pandagram #instagram #photography #animal #nature #pandaeyes #bhfyp _pink background_panda_Wizard hat_Golden necklace 2_Sunglasses orange","image":"https://raw.githubusercontent.com/GamingPromotions/picHost/main/PandaCute/PixelArtBigger512/915.jpg","attributes":null}
