{"external_url":"https://fullhd-wallpapers-brinis.blogspot.com/","properties":{"Background":"yellow background","character":"panda","Hat":"big wizard hat","Necklace":"Diamond  nicklace","Glasses":"Sunglasses orange  and Brown "},"name":"Pixel Art Cute Pada #5134","description":"Pixel Art Cute Panda is a collection of 5,000 unique generated pixel art Panda, stored on the Polygone Blockchain.   #webarebears #cuteanimals #like #icebear #instapanda #instagood #pandaexpress #pandacub #fiat #fiatpanda #redpanda #ilovepandas #x #zoo #wildlife #grizzlybear #handmade #music #apink #artist #china #pandaholic #fashion #teddybear #grizzly #japan #babyanimals #o #pubg #eunji  #panda #pandas #pandabear #pandalove #pandalover #love #cute #pandalife #pandalovers #pandababy #pandaworld #pandabears #pandastyle #bear #cutepanda #art #giantpanda #animals #babypanda #pandapower #pandacute #pandapanda #pandasofinstagram #pandagram #instagram #photography #animal #nature #pandaeyes #bhfyp _yellow background_panda_big wizard hat_Diamond  nicklace_Sunglasses orange  and Brown ","image":"https://raw.githubusercontent.com/GamingPromotions/picHost/main/PandaCute/PixelArtBigger512/955.jpg","attributes":null}
